cid,text,stance
1420641855904595,"🗣️¡SU VOZ IMPORTA! Comparta su historia y si es elegida reciba $50. Cuéntenos sobre facturas altas de electricidad o gas, auditorías energéticas, paneles solares, vehículos o estufas eléctricas, asma, alergias o calor extremo, migración por clima o desastres, o cualquier otro tema relacionado. ¡Queremos escuchar su experiencia! Siga el enlace y cuentenos. ℹ️ Válido hasta agotar fondos disponibles.

🗣️YOUR VOICE MATTERS! Share your story and, if selected, receive $50. Tell us about high electricity or gas bills, energy audits, solar panels, electric vehicles or stoves, asthma, allergies or extreme heat, climate- or disaster-related migration, or any other related topic. We want to hear your experience! Follow the link and tell us. ℹ️ Valid, while supplies last

🔗 https://forms.gle/MLK2vVeWTmGvTdc5A",Pro-Climate
1096084738918057,Michigan is at the forefront of new technology with the launch of this new climate investment fund. This will help ensure Michiganders are the ones who see the fruits of the new energy economy!,Pro-Climate
614967584207379,"Our ocean is everything. From providing most of the oxygen we breathe to shielding us from the worst impacts of climate change, it’s our greatest ally. This Giving Season, your support helps us protect vulnerable marine ecosystems. Give now to multiply your impact for our oceans!",Pro-Climate
1235188851714801,"With 8,000 energy experts and countless ways to save, we’ll help you use less energy so you can play more, share more and make more.,With 8,000 energy experts and countless ways to save, we’ll help you use less energy so you can play more, share more and make more.",Pro-Climate
1477818950071744,"Support Bradford jobs that can't be outsourced. Local renewable energy development means long-term careers in construction, maintenance, and operations.,Support Bradford jobs that can't be outsourced. Local renewable energy development means long-term careers in construction, maintenance, and operations.,Support Bradford jobs that can't be outsourced. Local renewable energy development means long-term careers in construction, maintenance, and operations.",Pro-Climate
1231799117736800,"Tune in Live to HT Talks tomorrow to listen to 1M1B Founder, Manav Subodh talk on ""Leveraging AI to build a Green Future"".
A topic of prime importance as we embrace a green future that will be powered by AI.

#GreenSkills #AI #ArtificialIntelligence #GreenEconomy",Pro-Climate
1571705450446119,"Arts Week Film Fest at Longmont Public Media presents a screening of “Fracking the System” with filmmaker Brian Hadden.

Fracking the System is a political thriller documentary from the front lines of climate justice activism in Colorado. When a fracking mega-site gets moved from a White neighborhood to a BIPOC neighborhood, a concerned mother fights to try and stop it. She soon joins the state-wide movement to change the law but the powerful oil and gas industry fights back with lawsuits, radicalized harassment, political sabotage, and $50 million. Fracking the System is an investigative exposé about the harms of fracking, the lengths to which the government is complacent with industrial pollution, and the nefarious tactics the oil and gas industry uses to undermine democratic elections.

Doors Open 6:30 PM, Show 7:00 PM. Immediately followed by Q&A with the filmmaker.
Limit 40. Please Register in Advance. Free Admission with Suggested Donation $7 at the door. BYOB.",Pro-Climate
855656712600511,"Start the conversation about climate change at home. 

Learn together and make informed decisions as a family.

#ClimateMyths #Interdisciplinary #ClimateScience #Collaboration #Science #ClimateChange #Family #Education #ClimateAction #ClimateEvidence #ScienceMatters #ClimateChange #Science #ClimateAction",Pro-Climate
724039496802309,"Wildfires can be unpredictable, but your energy efficiency doesn't have to be. Our spray foam insulation helps reduce energy waste and supports a more sustainable future.",Pro-Climate
1234630378230381,"A energia solar está liderando o caminho para um futuro mais limpo e brilhante.
Ao investir em energia solar, você não está apenas economizando dinheiro, mas contribuindo para uma mudança global em direção à sustentabilidade.

Principais destaques:

A energia solar e eólica foram responsáveis ​​por mais de 22% da geração total de eletricidade.

Este marco marca uma mudança em direção a fontes de energia mais limpas e renováveis.

O futuro é alimentado pela sustentabilidade!

O que isso significa para você?

--------------------
Solar and wind are leading the way to a cleaner, brighter future.
By investing in solar energy, you’re not just saving money – you’re contributing to a global shift towards sustainability.

Key Highlights:

Solar and wind accounted for over 22% of total electricity generation.

This milestone marks a shift towards cleaner and renewable energy sources.

The future is powered by sustainability!

What does this mean for you?",Pro-Climate
7482399291882776,"What is community solar?⁠
⁠
This is a pathway to equitable access to solar power, also known as shared solar or solar gardens. Community solar enables customers (or subscribers) to buy or rent part of an off-site solar system and receive credit on their energy bill for the electricity it produces. ⁠
⁠
#communitysolar #solarpower #climatebasics",Pro-Climate
1683238005891156,We need to overcome the influence of Big Oil and Gas. Take action to prioritize people over profits. Support the pause of new Liquefied Natural Gas (LNG) export permits.,Pro-Climate
486170377328366,"IYKYK about @erewhon’s Island Glow Smoothie. The fact that it’s served with a sustainable marine biodegradable, home and industrial compostable phade straw is just the cherry on top! 

#phadebluestraws #blueisthenewgreen #erewhon 

📸: @_nadia.kim",Pro-Climate
468587299511275,"🌳 Protect Our Forests, Protect Our Future! 🌳

Mature and old-growth forests play a crucial role in absorbing carbon pollution and fighting climate change. Yet, the U.S. Forest Service's National Old-Growth Amendment Plan (NOGA) falls short of safeguarding these natural carbon sinks.

🚨 Tell the Forest Service: Strengthen NOGA to prioritize the protection of mature and old-growth forests and deprioritize commercial logging!

📢 Sign our petition before the September 20 deadline. Let’s defend our forests, the Midwest, and our planet! 🌍",Pro-Climate
3057144957767309,"Elephants play a remarkable role in the fight against climate change.

As they forage and graze, elephants eat or crush small plants and trees. This allows larger, slow-growing trees get the sunlight needed to grow and capture carbon.

Studies show that just ONE elephant can increase the carbon capture of a rainforest by around 9,500 tons per square kilometer!

We all have a role to play in the fight against climate change. 🌎 Whether it’s eating more plant-based foods or opting for public transportation, what are some climate-friendly actions you take? Let us know in the comments, you might inspire someone else to take action as well!",Pro-Climate
877496174365893,"The anthropogenic warming of the earth often seems abstract, so let’s get more specific and nerdy together on this topic. 🌎🌱🤓🍃 The science is super interesting!

There is currently 427 ppm CO2 in the atmosphere, yet if current emission trends continue, it is projected that the world could reach 700 ppm of carbon dioxide (CO₂) in the atmosphere by the late 21st century—likely between 2075 and 2100. This projection depends on factors such as global energy policies, fossil fuel use, and efforts to reduce emissions.

The last time the earth had 700 ppm in the atmosphere, what was earth like? 

Comparable conditions in Earth’s past occurred during the Middle Miocene Epoch around 15 million years ago. 

Climate of the Middle Miocene Epoch 🔥 ~>

Average Global Temperature 🌡️

The average global temperature was about 65°F, which is approximately 5.4°F warmer than today’s average temperature of around 59°F (15°C). Climate models predict global temperatures would rise between 5-7°F or more above pre-industrial levels for us under this scenario. 

Sea Levels 🌊

Sea levels during the Miocene Epoch were estimated to be 50-80 feet higher than today. This increase was due to reduced polar ice, especially in Antarctica, where much of the ice had melted due to the warmer climate.

This level of warming would likely have profound impacts, including:

1. More frequent and severe heatwaves, droughts, floods, and storms.

2. Ecosystem Disruption: Further loss of biodiversity, particularly in sensitive ecosystems like coral reefs and polar regions.

3. Agricultural and Food Security Challenges: Changes in rainfall patterns, temperature extremes, and more intense droughts could affect crop yields and food supply.

The process of sea-level rise could take centuries to fully manifest, even after CO₂ levels stabilize. This would be a substantially different world for our grandchildren and great-grandchildren. 

Did you know about the Middle Miocene Epoch?",Pro-Climate
515607691541431,"From our Executive Director, Bill Lazar:

""As part of National Homeownership Month, we should keep our eyes on long-term affordability. 

The @[100064933502334:2048:ENERGY STAR] program has helped raise the bar for residential construction in a meaningful way. In 2003, The St. Johns Housing Partnership developed a 36-home subdivision, The Hancock Place. It was a public-private partnership, where the St. Johns County government provided funding for the infrastructure and regulatory fees. 

In return, we built homes to a higher standard, masonry construction, and both Energy Star and green certified by the @[100064389201667:2048:Florida Green Building Coalition]. Our affordable homes were not only energy efficient, but the buyers qualified for a little more purchasing power because the homes had lower utility bills. 

In 2008, the @[100064734458928:2048:U.S. Environmental Protection Agency] awarded SJHP the SE Regional Award for Excellence. To this day, building a home that doesn't waste money on electricity makes more sense.""",Pro-Climate
1067506528078497,"Land conservation is crucial to climate resilience, especially in Florida where intense flooding will become inevitable. 

https://bit.ly/3B97tYG",Pro-Climate
2269456833405370,Teachers—students deserve to know the facts about climate change. Pledge to show your commitment to professional autonomy & environmental education.,Pro-Climate
718615164494735,"🎥 New Video Alert! 🎥
Let's talk about Promise #5 - Invest in Our Kids and Families

Our civic center was built in 1971—over 50 years ago—and it shows. Meanwhile, our youth sports fields are patchy, uneven, and poorly maintained, even as our programs continue to grow.

Leeds families are looking for safe, clean, and modern places to gather, play, and connect. But what they see instead are:

- Parks with no restrooms, and the few public bathrooms we do have are poorly maintained

- Facilities that haven’t been kept up—making it hard to take pride when we host visiting teams

Meanwhile, neighboring towns have nice, well-kept parks, community centers, and sports facilities; and they’re attracting families and small businesses because of it.

These things matter when you're building a community that’s proud, engaged, and growing. People want to live, work, and invest in places that show they care.

💰 Let’s Talk About the Money -
Leeds is carrying enormous debt. So what do we have to show for it?
Not a modern civic center.
Not quality recreational spaces.
Not consistently maintained parks or public areas that show we value our residents.

It’s fair to ask: Where did the money go?
Here’s the truth:
 ➡️ Too much has gone to consultants, lawyers, developer giveaways, and bad bond deals.
 ➡️ Not enough has gone into improving everyday life for the people who live here.

✅ How We Fix It
1. Get Serious About Parks and Recreation
- Develop a Parks Master Plan with real timelines and community input
- Prioritize fixing neglected parks and public spaces
- Build and maintain modern facilities 

2. Stop the Waste
- End or renegotiate corporate giveaways that don’t give back
- Cut excessive consultant and legal spending
- Say no to bond deals that don’t benefit residents directly

3. Invest in the Heart of the Community
- Fund facilities that support youth, families, and small business events
- Maintain and improve what we already own
- Build transparency: show residents where every dollar is going

Leeds has great people and great programs—but we’ve neglected the places those programs are supposed to happen.

It’s time to match our community’s energy with real investment in the public spaces we share.
🌳 Well-kept parks and facilities aren’t luxuries—they’re signs of a city that values its people.
🛠 Let’s stop wasting money and start building a better Leeds, together.

For more detailed information visit https://carykennedyforleeds.com/

#LeedsProud #InvestInLeeds #FixLeedsFirst #SafeSpacesForAll #DoBetterLeeds #FixTheNeglect #StopTheGreed #ServeThePeople #CaryKennedyForLeeds",Pro-Climate
510029555089042,"That’s right: 121,800 gallons of clean water per hour! 🚰💙
 
Our nonprofit built and continues to maintain these clean water systems that each community in the Pilón Lajas Biosphere Reserve has access to. During this past year and a half, we purchased a new well-digging machine to aid in future projects, built a new well in the community of Corte, and conducted maintenance on multiple systems.
 
We have recently begun prep work, including land measurements and research, to install irrigation systems in their food forests and gardens and put in a new water system in the small community of San Bernardo.
 
Irrigation is a new need that is related to climate-change-caused droughts. The rain has always been sufficient in the rainforest to grow food, but these droughts are devastating their ancestral ways of living in the jungle, and new ways of adaptation are necessary.
 
You can play a crucial role in helping us implement these new systems by committing to a recurring monthly donation through the link below! Help create lasting change and empower these communities to thrive by clicking the link in our bio and setting up your recurring donation to support the people of the Amazon and the preservation of the rainforest.
 
https://www.paypal.com/donate/?hosted_button_id=SQD3EMXSQRN58
 
Read the rest of our Impact Report showing our work from January 2023 to March 2024 through the links in our bio, available in both English y Español for our wonderful, bilingual community!
 
English: https://drive.google.com/file/d/1GiqCBKi0VVrLUpwM1-gCYFBZSjoK98Lg/view?usp=sharing
 
Español: https://drive.google.com/file/d/1nnsz1sClm2nUUdbBP37mxN4Ef3NIQn7s/view?usp=sharing
 
Photo by Abner Paredes Peñarrieta 📸",Pro-Climate
1385094385791990,Solar Energy Company,Pro-Climate
1608521119857000,ACTION ALERT: TVA is proposing the expansion of a methane gas plant at the Allen site in Memphis that would lead to higher bills & more emissions in a community already unfairly burdened by pollution. Use our form to tell TVA that Memphis deserves better: ow.ly/NkMS50VA5FW,Pro-Climate
610437014791961,"💦ƬƦƠƤƖƇƛԼ ƲƝƊЄƦƇƠƔЄƦ💥
Maybe if we went undercover in the sea we could stop overfishing and boat pollution! Basically, doing the job of bewitching sirens to confuse and protect!
💫💪🧜‍♀️🧜‍♂️🦜🦚🐠🦈🐙🐚🦋🌴🌊☄️
........................🔥........................
Peut-être que si nous nous infiltrions dans la mer, nous pourrions arrêter la surpêche et la pollution des bateaux ! En gros, faire le travail de sirènes envoûtantes pour confondre et protéger !
🐟🐳🐢🥁🐊🐋🐬
.
.
.
#mermaid #mermaidtail #siliconetail #undercover #tropicalparadise
#tropicalfish
#tropicalvibe #protecttheocean #siren 
#overfishing #oceanpollution #workshop #atelier #merlove #mermaidfantasy #fantasy #artdecodesign #artnouveaudesign #strongwomen #fin #mermaidfan #finfolk #merfolk #fx #iwata #smoothon #dragonskin #colorfullife #wildlife #cyntaultcreations",Pro-Climate
1350133636410593,"Inequities like hunger and access to clean water need urgent action—and AI offers a key opportunity, says @[100044434389674:2048:Ian Bremmer].

During a #GlobalStage conversation at the United Nations, he and UN Deputy Secretary-General Amina Mohammed discuss how the global community can responsibly deploy AI to meet these goals.",Pro-Climate
1629198097796463,"🌊 CRAs are an Investment in Your Community - learn more at https://redevelopment.net/redevelopment-works/ 

From an industrial hub to a beloved community gathering place, and later a neglected site, Bruce Beach has now been revitalized into a thriving waterfront park—thanks to the vision of the City of Pensacola CRA. 

Phase one of this transformational project has created a connected, accessible space featuring a central plaza, cultural exhibits, native landscaping, wildlife-friendly lighting, and a pedestrian bridge overlooking historic Washerwoman Creek. By linking neighborhoods, improving walkability, and restoring the natural environment, Bruce Beach is now a place where history, nature, and community come together. 

This redevelopment isn’t just about today—it’s about investing in a more resilient, healthier, and sustainable future for Pensacola. Community Redevelopment Agencies (CRAs) play a crucial role in ensuring communities thrive for generations to come.

#RedevelopmentWorks #Redevelopment #FloridaRedevelopment #MyFRA #FLRedevelopment #Pensacola #PensacolaCRA",Pro-Climate
1649195558991290,"There's a lot at stake this election—including the future of our planet. In Maine, registering to vote online is easy, so make sure your voice is heard and register today!",Pro-Climate
1915115742301998,"We're thrilled to share that @[100056383431369:2048:Engineering News-Record] MidAtlantic has recognized the Ryan Resilience Lab for Excellence in Sustainability with their Award of Merit for Office/Retail/Mixed-Use facilities.

The Lab serves as a global model for coastal resilience, demonstrating cutting edge green building practices and systems – floating docks, green roofs, solar arrays, rainwater capture, and much more. Thank you to the judges for highlighting the sustainable design work performed by our team & our collaborators at @[100063964383997:2048:Work Program Architects].

Learn more: https://brnw.ch/21wNUfm",Pro-Climate
1703086553728001,"🎉 Happy 13th Service Anniversary to Alex Carter! 🌿

Alex serves as our Director of Ecosystem Resilience, leading vital work that protects and strengthens our region’s natural environment. For over a decade, he’s collaborated with partners across the North State on land-use, forest health, climate, and wildfire resilience efforts—helping shape a stronger, more sustainable future.

We’re grateful for Alex’s steady leadership, deep expertise, and commitment to community-based solutions. Here's to 13 years of impact—and many more ahead!

#TeamMcConnell #ServiceAnniversary #EcosystemResilience #WildfireResilience #Gratitude",Pro-Climate
834029045536903,"Wildfire smoke can affect air quality in areas thousands of miles away from active wildfires. Monitoring air quality indexes and advisories are crucial to minimizing exposure to harmful pollutants. Just as you check the weather forecast each day, check the air quality index for your area. 
The U.S. Air Quality Index (AQI) measures air pollution according to the Clean Air Act of the Environmental Protection Agency (EPA). The AQI has six color-coded categories to help you quickly determine the air quality in your community. 
• Green — Air pollution poses little to no risk, and the air quality is satisfactory.
• Yellow — Air quality is acceptable, but there may be a risk for people sensitive to air pollution.
• Orange — While most people are unlikely to be affected, people sensitive to air pollution may experience health effects. 
• Purple — The risk of health effects is increased for everyone. 
• Maroon — Everyone is likely to be affected by the hazardous conditions.",Pro-Climate
404340095622973,"Big Oil’s allies are scheming to undermine our progress, like EV incentives. Send a letter to urge your representatives to fight back against these fossil-fueled threats.",Pro-Climate
24546985014918863,"Before each lesson:
•  Rebound and ask for forgiveness of your sins.
•  Request the filling of the Holy Spirit so you can      
   understand God.
•Pray on the Armor of God so you can revisit Satan’s modus operandi on this earth.

𝐅𝐈𝐍𝐀𝐋 𝐀𝐍𝐀𝐋𝐘𝐒𝐈𝐒 𝐨𝐟 𝐆𝐎𝐃: 𝐓𝐇𝐄 𝐎𝐑𝐈𝐆𝐈𝐍𝐀𝐋 𝐀𝐈

God of the Bible - As the Supreme Creator of All Things, Sustainer of all things angels/human/animals/the universe, and nowhere in scripture can you find anyone, other than God creating new things from nothing.

Angels - Created beings, limited in knowledge and power. Eternal beings, that will never die, made to handle God’s messaging, intervention and inspiration to God’s creations and can only do what God allows them to do. Can only use the materials God created to make new things, this is not creating from nothing, just rearranging of molecules to get a different form of the same or multiple substances. 

Look at our world under the duress of all the natural resources of God, being reformed into things, such as plastics, air pollution and other factors at a rate it cannot sustain, all for our own pleasure or recreation. 

Humans: created beings, weaker than angels in knowledge and strength but endowed with God’s image, the only creation in the Bible He does that with. We are created eternal, then man became sinful, and by that death entered our world. We gave power to Satan by giving him our role, as stewards of God’s creation on Earth. 

𝐇𝐨𝐰 𝐚𝐫𝐞 𝐰𝐞 𝐝𝐨𝐢𝐧𝐠 𝐰𝐢𝐭𝐡 𝐭𝐡𝐚𝐭 𝐬𝐨 𝐟𝐚𝐫?

Let’s not forget the animals of all kinds, sea life, land and our glorious universe, were all tainted by our sin and also die.

AI: Created by sinful man to enhance his intellect and power, with the fatal flaw being that all creation is under sin. Nothing new can be created by AI. It really doesn’t have power unless you allow it to.

Across the world, additional power plants and chip manufacturers have been removing rare Earth materials, further depleting our natural resources and polluting our world.

Copy and paste the following link to read about the Rare Earth Minerals-The Dirty Little Secret, found on Newsbreak.

https://www.newsbreak.com/share/4116823333561-why-i-no-longer-believe-in-green-energy-and-why-you-should-look-closer?s=a8&share_destination_id=MzA0NTQ4NjE3LTE3NTMwMTM5OTM3NzY=&pd=0Kbr0Ted&hl=en_US&send_time=1753013993&actBtn=bottomBar&_f=app_share&trans_data=%7B%22platform%22%3A1%2C%22cv%22%3A%2225.29.0%22%2C%22languages%22%3A%22en%22%7D&sep=ns_foryou_model_exp_25q2_v2-v9%2Cns_foryou_rank_exp_25q2-v3%2Cns_foryou_recall_exp_25q3-v9%2Cns_foryou_blend_exp_25q2-v9

𝗧𝗛𝗘 𝗙𝗜𝗡𝗔𝗟 𝗤𝗨𝗘𝗦𝗧𝗜𝗢𝗡 𝗧𝗢 𝗠𝗔𝗡𝗞𝗜𝗡𝗗:

𝙈𝙤𝙣𝙤𝙩𝙝𝙚𝙞𝙨𝙩𝙞𝙘 𝙫𝙨 𝙋𝙤𝙡𝙮𝙩𝙝𝙚𝙞𝙨𝙩𝙞𝙘. - 𝙄𝙛 𝙤𝙣𝙡𝙮 𝙤𝙣𝙚 𝙘𝙧𝙚𝙖𝙩𝙤𝙧 𝙤𝙛 𝙖𝙡𝙡 𝙩𝙝𝙞𝙣𝙜𝙨, 𝙖𝙣𝙙 𝙚𝙫𝙚𝙧𝙮𝙩𝙝𝙞𝙣𝙜 𝙞𝙨 𝙘𝙧𝙚𝙖𝙩𝙚𝙙 𝙥𝙚𝙧𝙛𝙚𝙘𝙩𝙡𝙮, 𝙬𝙝𝙮 𝙙𝙤 𝙮𝙤𝙪 𝙣𝙚𝙚𝙙 𝙤𝙩𝙝𝙚𝙧 𝙜𝙤𝙙𝙨?",Pro-Climate
1295413044924803,I'm Rep. Diana DeGette and I want to hear from you. Is Climate Change an urgent issue? Take this 1-minute survey to share your feedback.,Pro-Climate
1318428005767018,"The Shell PA Petrochemical Complex promised to revitalize the community, but Moms Clean Air Force's  Rachel Meyer tells the Guardian  it didn’t take long for the community to realize that the facility would bring “environmental disaster.” #CleanAir4Kids #MomsMakeNews #momsactnow",Pro-Climate
