cid,text,stance
bafyreih66f3ymzdtfegv4qndrqu2jexs3cody5mk6vzraqn2bayv4hxxta,"Here to learn from the  #EnergySky  fam. I’m a career investor in clean energy but looking into some “new to me sectors.” If there’s anyone I should follow who’s knowledgeable on sustainable chemicals, plastics recycling, or water tech, please tag!",Pro-Climate
bafyreih7pyd7fydponbp66yl4r6ryo7omwydohwjvsspzm5u4qlyq6kuau,"California's fire season is now year-round thanks to climate change. These LA fires are just the latest example. We're losing precious lives, homes, wildlife, and ecosystems.

Find out more about the climate crisis at eia-international.org/climate

#wildfires #losangeles #climatechange",Pro-Climate
bafyreiat25rejfrhtqf33yswnk2okrzq2jrmexnnow7fzco7suwkl6it7m,"Shhh ... don't talk about the damage from climate change, it'll harm Putin's disinformation offensive #r4today",Pro-Climate
bafyreia56dskbkntnclkainodb35bmog2qdjgdhufkvia64ulrgrxjsuxy,"@GreenFire

To the extent that PV panels leech toxic metals into the soil, if they do at all, that's a problem that can be addressed without banning them outright. Meanwhile, the FF companies fight like hell to overturn even modest requirements to reign in their pollution.",Pro-Climate
bafyreigkujdi3jozba4kp5xywvmwzm2kwu5xvs7qpnytcn5avgtwqbzoa4,"They see the word climate and just automatically think research into climate change. 

Completely the opposite. This is the USA weather data repository for an incredible range of research. We use the model analyses for example to develop better weather models. Holds the entire record of weather obs.",Pro-Climate
bafyreicamr6ahiptjevhsmbnzn56wofgnyibd3cescj7d7olo2geekdqxy,"We need a fast and fair way to tackle climate change. This means a plan to phase out fossil fuels for good. Our politicians need to hear loud and clear that this is what we want. I’ve emailed mine, will you contact yours too? 

act.globaljustice.org.uk/node/4339/",Pro-Climate
bafyreifxrvkqz4df7y2pgckylwey3sjajwybyaywbzaqqu7m2vcux7gaey,"NEW: Some oil and gas companies want to limit methane, a super powerful greenhouse gas warming Earth.

Nonetheless, Congress is about to kill a federal methane program that had industry support. 

www.njspotlightnews.org/2025/02/cong...

@njspotlightnews.bsky.social",Pro-Climate
bafyreihucrr7xhogir7lxyasymkcceulnn25i2zc2sqyedk7r5x252peci,"www.wsj.com/opinion/why-tesla-doesnt-pay-taxes-democrats-green-energy-ev-mandates-3cbb2fd3.

 (10/10)",Pro-Climate
bafyreidfn7qhfeufdzssxlc5di2hvbe42rfu27tndsmvjbq3wwrelkdnci,Smith has undermined every opportunity the province has had to diversify our economy. We lost over 50 billion in renewable energy projects when the people of this province could have used the employment and has yet to hold O&G accountable to cleaning up their well sites. She is a traitor to Canada,Pro-Climate
bafyreihb27i2dqki7bpeoxjbpw2bcvkeg3pygi3beyncvl7jjfz7q3zyvq,"Animal agriculture is literally the leading driver of deforestation, including the destruction of the Amazon rainforest 

The 🇺🇸 is the 2nd largest importer of Brazilian beef",Pro-Climate
bafyreicnlwoynn5uvvhwemnsfpyx5ljoni4nzzzekjemgg4iiqypvqzabq,"I try, each day, to imagine a future of renewable energy, community gardens, people working together for the things we want. I might start writing down these imaginings just to hold them a little tighter.",Pro-Climate
bafyreidejedfukgc2ddfmf435xijhsps4icg4t3ssdl5suvbfxzqrhfpuu,"Always start by assuming that what an AI company is claiming is bullshit. From that starting point, assess what useful information is there. I recommend against sharing anything from AI companies. Memetic pollution spreads fast.",Pro-Climate
bafyreia2uqhigosdfbw334ym7hglmcjvrow3qqiyfdaisk5l4ailuh7g3i,"The Seine River, in Paris 🇫🇷, was once a fresh and healthy river which people swam in 🏊 prior to 1923. After that, the river started to be polluted, and although it hosted swimming for the Olympics 🥇, the prior and current pollution caused multiple athletes to get sick.",Pro-Climate
bafyreifvfvyxy4hokha5d2bupeguzcsqb557ftep4hfbbkdopxengegpwy,1/4 Blog @lawfaremedia.org with @alcis.org funded by @XCEPT It focuses on the transformative effects of solar power: how it has supported Afghan farmers cope with climate change but ultimately how its expansion now threatens the livelihoods of 3.65 million people www.lawfaremedia.org/article/unde...,Pro-Climate
bafyreibppkhm5mqzg2sxwerndra4vfkvz5izxspaabqefkmqyoqobvhbea,"If WW2, the Blitz and the Battle of Britain are the UK's modern creation myths, then Threads and other nuclear war narratives are its eschatology, or at least some of them,  More pressing threats face us now, but mushroom clouds are always more evocative than climate change, particularly in Britain.",Pro-Climate
bafyreid4khsizkprcjnavdzunxy4k34wxskyt624yaunfqzad32n3mjjjy,"I'm feeling major eco-grief.

The goal should be to phase out fossil fuels ASAP, not increase the consumption of electricity so much that that's not possible.

Here's a rather long thread of reasons to support 100% clean, RENEWABLE energy systems instead of nuclear power: 
bsky.app/profile/suzw...",Pro-Climate
bafyreigl2ggpwmqnkpgpbjwaow7zyn7s7leukvlerb5nvwbufkxv62vpmm,"EXACTLY! IOWA BUSINESSES ARE ALREADY CLOSING. LAYING OFF HUNDREDS. GOP REPUBLICAN DOGE LACKEYS ARE GUTTING EVERYTHING, THE STATE PARKS; SOCIAL SECURITY;  MEDICARE; SNAP; THE VA; VETERANS; EDUCATION; RENEWABLE ENERGY;  HEATHCARE; MENTAL HEALTH
LAKES, STREAMS FULL OF ECOLI. 
IOWANS DIDNT PAY FOR THIS!",Pro-Climate
bafyreieyxvdmmhtrqae6x33q6fx6dhidsek3tjmlok337agviltw3hfywy,Top MAGA scientists conclude climate change fully reversed due to success of Trump policies,Pro-Climate
bafyreierhu2ygcwi57uosnodc4cioohrtaavnxoaqpvflzdugpggwittfm,"Oil ain't the problem with climate change, but slavery is the problem to oppress the poor",Pro-Climate
bafyreia7w6s7c7332ekvukoozrn7f3zelg7bldl2fnccjmbprkbr4lcya4,"The study itself is much more nuanced. They say reductions can be achieved in combination with other sustainable practices like reducing food waste, socioeconomic improvements, and also use of weasel words such as ""with reductions up to 18-29%."" /2",Pro-Climate
bafyreigi2vjfbtpqyo5vmr3kbwoh2shfyrocswosa7itasswyfue6vz45m,"Germany should consider health effects of climate change across all policies - expert council
->Clean Energy Wire | #Health #ClimateChange | More info from EcoSearch",Pro-Climate
bafyreieybhhdtjntyamwgfwtrvrltj4dcqlbbgro2w5mavxvjp7spcnazm,"I agree this framework applies well to present UK climate/energy politics! I'd place a greater emphasis on transit policy, which is a longtime organizing focus in the UK, a major Tory failure, but a soft/ill-defined spot in Starmer's clean-growth agenda.",Pro-Climate
bafyreiabkpzzvu7nwotzbnoos6rgyi46exwocu4pnvpb2w7ekmmkdc5xsa,"Rolling back these protections means more carbon and methane pollution—and a major setback for U.S. climate goals. We need stronger climate rules, not weaker ones.",Pro-Climate
bafyreibcddqbvnzvh5zkyc7tbqorzabmdnwydmmquole4ops5irnyqitua,"The thing that gets me too is like, sure, you can blame the Trump cuts for a lot of damage and loss of life. But also, a flash flood this devastating is mostly the result of climate change, and the same boomers I see being snarky about the death of kids also love AI slop.",Pro-Climate
bafyreiau7cjuohc5s2d474kcfc3fvqsugumo72drcev7ukocudgbkzrxem,"Oh my bad, you are right. I knew it went back to individuals, but I thought 10% went to dealing with climate change emergencies like wildfires. I guess that comes from a different federal budget. Thanks for letting me know my mistake.😉",Pro-Climate
bafyreigpoaghgga2sbwubknjvlqhsl27hi66jw3jwun25pqo7pyylbhc2i,"Capturing and storing CO2 in Europe will be critical to meet climate goals.

The EU’s Net-Zero Industry Act places a binding obligation on oil and gas producers to actively support CO2 storage – marking a decisive step toward decarbonisation of hard-to-abate sectors.",Pro-Climate
bafyreifxf5dxau3yavp5f5eqquujxo76t2vzbz6mzyznkza2ajmcmduxdu,"Absolutely - climate change is driving migration, societal collapse and natural disasters. It should be our number one priority.",Pro-Climate
bafyreiagno45kanhnutzdvlj6sh3eoejuvtr7vibrcuweundhwi72fgv4y,"Labor spend more time bribing @unesco.bsky.social not to list the reef as endangered than it does protecting it . Labor and UNESCO are owned by the Fossil fuel industry and have zero credibility in the climate and environmental community .
We see you ..
www.theguardian.com/environment/...",Pro-Climate
bafyreiedhij2h2blgz54v6qpegnreaordttnr4e62xmg5vdyd3emj67d6u,"Reforms to UK offshore wind

https://www.byteseu.com/777019/

25 February 2025 by Alex Brinded Proposed reforms by the UK Government to pave the way for clean power by 2030. © Nuttawut Uttamaharad / Shutterstock These reforms would create an energy system with lower bills for households and …",Pro-Climate
bafyreihbjp2ytth3lxfltxwfh2tecdnzzyjxakwvdpnvlm2fdgnmvd6z3u,Authenticity sells. Aligning with nature = no greenwashing. It shows you walk the talk on sustainability and values.,Pro-Climate
bafyreibbyt2gsmonzygh2tyqx4rouralcq7qq2jfflzl7rivg6jtkzja6i,"Klobuchar has routinely been voting for Trump's nominees. One example: she's the ranking member of the Ag committee and yet she voted for Brooke Rollins, a climate change denier, to be Secretary of Agriculture.",Pro-Climate
bafyreiee7nrnw4hcba7ua2lacha3iywonnp5ensifnedumgc4kvbuntevq,"Irreplaceable old-growth forests are logged daily. 96% of global deforestation hits tropics,6.6M ha in 2022 alone. Over 1,200 arrested to save them. No more delays. No to deforestation of our remaining forest #ProtectTheIrreplaceable #ClimateAction",Pro-Climate
bafyreigj2b4bsybtz3vwkmgmmwdidkf6xp4ganade37jytln2woocjtbna,We also have lots of fresh water in Canada. Something he mentioned in campaign… which to me is very worrisome as climate change is reducing groundwater reserves in  US. Maybe I’m paranoid….,Pro-Climate
bafyreie3noa4teias66e3w2hb74d45f7phyuvs26jcozfhvmjqzzwf7idm,"After stealing credit for the hostage release that Carter brokered, Reagan's FIRST EO, was to remove the solar panels and doom the US to fossil fuel dependency and all the war death and violence because of it.

Republicans are vile sociopaths. 

PERIOD.

Capitalism is destroying US.",Pro-Climate
bafyreiet27dwac2fahbfhwocsmdds5hprmofp3kwcsfpxlveuz46y625zm,"exept for the cold snow, but due to global warming there won't be any anyway",Pro-Climate
bafyreiaedl3b3ljtac7263baokj3dd6oegrzwlndlsobpotxtsfhdsvzyy,"Just for the sake of contrast: Democrats invested $400,000,000,000.00 in renewable energy during Biden's term.

Both sides aren't the same, and the differences matter.",Pro-Climate
bafyreih7bmz3klfwdci7lhoxlg4w43xmwudrsubvb6jhnku4hrsgl4t2wu,Climate change isn't declared a national emergency. Assault rifles are legal. School shootings happen every week. Necessities aren't affordable. Why? Because rich people are paying for these problems to never be solved and are profiting from these issues. (2/4),Pro-Climate
bafyreibepjjdgmxl6tylb22jmxijfw7hrybkk4a2ypymsyktmihbirn224,"Matt (or the Breakthrough boys he's caping for) rejects the policies required to hold temps to 2 degrees, which is an implicit argument that those policies would be worse for human welfare than the climate change they avoided. OK, fine. How much policy effort *is* justified?",Pro-Climate
bafyreiayuk4rmaeuwru2gszjhprt6qifd357qrumfci3lzxhnroadyllue,I’m sure the fact Labour have received a £4m donation from an arms and fossil fuel investing trading firm is completely incidental.,Pro-Climate
bafyreihbegntj6eif3g2kr7aawujio2lxtr5vfs6zl3fzzqlg6zhpwwdiy,"COP29 ""inappropriate corporate influence and captured by the fossil fuel sector""",Pro-Climate
bafyreidul2agtck2mri7m3o6ihrxydghx5s3br5pbdz3zdo7zylnnl62cu,WE NEED TO DEAL WITH CLIMATE CHANGE WHAT THE HELL,Pro-Climate
bafyreibxslwdpk5bbilaagnisnvgs6eehyugey4pfl6vn7jipst75x3c5a,"The stupid woke liberals want you to think climate change is real.

Stupid woke liberals!

Joni Ernst believes in commonsense ideas like climate change is God creating beach-front property.

Joni Ernst: Everyone should have beach-front property!

Hi, I’m Joni Ernst, and we are all going to die!",Pro-Climate
bafyreianm4325ct722hhwmgnzj26d5c3qbvlvq4bpccbyiwcilep5lg3uu,"And the rabbit hole goes deeper, Tesla’s stock dives, Trumps vultures circle. Trump and his cronies buy Tesla and dismantle it for the fossil fuel stakeholders. Trump and Musk are not friends. Trump will bury this guy for money and power. They all get burnt.",Pro-Climate
bafyreib7qbfp5rahckict2kdnch4thpmpaoodornma3qfxnu2jhzww74pi,"•suppress scientific research on climate change, fracking, or any other issue that a majority of scientists agree upon.
•criminalize abortion or restrict healthcare for women.
•violate the Geneva Convention.",Pro-Climate
bafyreihlqf6b4wsywbmzjedfkfp6hg3ie72e3kgiimvhnc44ockjevaqve,"That's the highly improbable scenario of net zero by 2055 with other forcings stable after 2030.

In practice greenhouse gas emissions are still going up and aerosols are rapidly decreasing, causing the net forcing to increase.

So it's not surprising that we're passing the model range",Pro-Climate
bafyreihe2tbx33mcihmvzfrapqocs6k2twbatmpul3mn7p5qpp2w27syki,"Have you any idea if it's linked to loss of revenue from the Elect companies (they are panicking), or is it a grid problem?I'm seeing governments (European Union) worried with the existing unprepared grid absolutely not designed for large scale renewable energy integration...",Pro-Climate
bafyreifesb2r75vaxp4y2teiukca4nkzoc4la46ssfn4tgfgpamkzh2l7i,Does really surprise me even though it is awful for her. These fossil fuel industries will go to great lengths to protect their profits. Our world is slowly choking to death on plastic.,Pro-Climate
bafyreidkimpjt4vz6k43eduzndy2tia43altwlooejbdokhgu44lorpnf4,"Here's my sketch of their emerging narrative: 

1. Climate change is real, it has always happened, and we can adapt, but will really only be disastrous for people not like YOU. 
2. In fact for people like YOU there could be upside! 
3a. But instead protecting people like YOU with adaptation...",Pro-Climate
bafyreiari5ozmnsa2jutq465yxadze3zahbfhv42gw6qg4oxq2hjuf5zde,"Climate change tests the wildlife conservation model in Namibia
->Resilience | #ClimateChange #WildlifeConservation | More info from EcoSearch",Pro-Climate
bafyreiga34mrz5j4sea7s7mcjzwapfrc3cztal4ryyxk545armcg2ngzoi,"MAGA do not understand how statistics work. If one person defrauds welfare, everyone does. If one vaccinated person dies of Covid, vaccinations don’t work. If it snows one day, there’s no such thing as global warming.  If one trans wins a race, all girls are affected.

MAGA be DUMB.",Pro-Climate
bafyreigx5kclytue342sym66zl25ozed2task6abe6ln6lxzlsz43dl4jm,"✨ Tired of endless searches for quality shops? Meet ooia.de Female-founded, sustainable period & bodywear loved by 400k+ women! 🌸 Swap disposables, save $$$ (check comments!). Shop smart: ooia.de #SustainableFashion #EthicalShopping #CycleSavvy",Pro-Climate
bafyreihtjmezqw4j4dny7hy5b27dpm7hep4crd4rbkqqtnhhwpn6jzxfze,This is what four years of strong moral leadership looks like—where jobs and benefits of our well-planned new clean economy accrue to the very red counties who voted against President Biden. Please let us pass this baton of civility and good governance to Harris. We can't afford to delay progress.,Pro-Climate
bafyreid3fzucrrzzue2izbpq7ja7wfyayy7ji6erpzk35ageijbcb4zh4m,…just like climate change,Pro-Climate
bafyreihqjf7klc2dm4me64juv644mygxro4r2nlqr6f7yyuj4qczvv6poa,"Instead of focusing on the real costs of air pollution and our car-centric transport system, we get stuck debating 'cycling behaviour.'

But the toll of cars and pollution is heartbreaking. This is Ella's story.

We should honour her with real, tangible change",Pro-Climate
bafyreicm4rgk7qahxk44623rwrideia7y7vaioxcrlwtn6fzlqltnjsa5m,"Welcome to the result of climate change.  Between China, who is number one emitter and USA, number two emitter, these two countries alone contribute nearly half of all annual global emissions",Pro-Climate
bafyreie6r2rumwfsvi3bdl7vekugtkkqczd3oqchqbltfrirb26at5bfke,"This shouldn’t be a problem for the Weather Service because there really isn’t any proof of climate change, and we’re due for a low hurricane season according to Frank, on his highly successful Tik Tok account.
Nothing to worry about.",Pro-Climate
bafyreiga5epjujtvkqiyv4cwmohbak6maze52thrt625snpoezn23sgvq4,"A mate just commented on Trumps behaviour: ""thing is immigrants aren't burning down whole neighbourhoods, or flooding whole counties. Climate change is doing that, and will do it more and more. The immigrants are helping tidy it up!""",Pro-Climate
bafyreid45dqi6pr3eebj6quiqfnm4q3xxcx3fjgilfqqbgipueljvrff2m,"i mean with climate change, who knows?",Pro-Climate
bafyreickl67wrnesrnokk4xypvoxn6z7ev257d7bpgclfaf24ueniuvgvq,Aha.  I thought it might be global warming & immigration.,Pro-Climate
bafyreickz5yg5c4v6m63mb5z2cfzq5fmnlzlecjl2foyh2stl7gyqoplga,"Why not ONE damn recount, Harris. 
Why not ONE damn objection, dems. 
Why acting blind & deaf to the Putinesque/Muskian election-stealing elephant in the room, most of you independent ""pro-democracy"" networks. 
Why letting loose a FKN CLIMATE CHANGE DENYING dystopian regime on the World/Planet, USA🤬",Pro-Climate
bafyreidrjgmudthevxgk2j56vwk6gnogbfya3pemazx4mzxa2ro4qy7xsy,"By integrating 3D data from various platforms, stereoscopic remote sensing observation provides a comprehensive and dynamic perspective of #mountain #ecosystems, which is essential for disaster management, #climate adaptation, and #sustainable development.
doi.org/10.1016/j.xi...
#remotesensing",Pro-Climate
bafyreifidxk6iz2koouhwppf3jcex2nzh2rsxlwuexu5kah344rywttgt4,"I believe in climate change, the Trump worshipping leader of Reform In GB doesn't. I don't think earthquakes are realeted to climate change, prove me wrong.",Pro-Climate
bafyreidsx6tdbop3qvkrczqpk56aees2odrgx74igtmdesz2hfqhbo4lfu,"Newly passed CA housing reforms (streamline development & use wildfire-ravaged lots for low-income housing) are marketed as improving affordability. But they highlight deep systemic failure: climate change is impacting land, weather, & housing.

@reuters.com
bit.ly/4fwVHYq",Pro-Climate
bafyreigtqwj75j2hpqxlakwwzra6sfzby67kwxhootefmq6el2hrxwisgi,Thiel and his techbro billionaire friends are most interested in extending their own lives and maintaining societal control that that’s all they are investing in at the detriment of unimportant things like poverty and climate change and fascism.,Pro-Climate
bafyreidkkj77djtuqnsf263amzwiy756p7wla43iufey4uq3xmfviqawcy,"Insurance companies have been telling government that climate change is real for years, they opted to make no steps to change and to push on with the same program because it was supporting their donors and paving the way for life after politics",Pro-Climate
bafyreiherekgp4l65rbl7ehzmwjanin2b3v3r54zbnvcdndnpo4umvo3vm,"We recall Trump's campaign pitch to the oil industry...

""In 2023, about 3.5 million Americans worked in jobs related to the renewable energy sector, and jobs in that sector grew at more than twice the rate of those in other sectors in what was a strong U.S. labor market.August 30, 2025""",Pro-Climate
bafyreifxzsnv3pud5emorclxu2uhb3k3e65s55d66emjl72zqsbxh57dmi,"The incoming President & all leaders should be dealing with the problem. We need to assist communities, business & industry, & states to adopt renewable energy, create nature-based solutions, & phase out fossil fuels.",Pro-Climate
bafyreie25eniq2dou72emibym5a427kg4frgldtzia5ri4tdokj6ocyqqa,"@dlrcc.bsky.social Ballyogan recycling charges the same price for entry by car as on foot or by bike. This seems very unfair as (a) the latter two groups will not have the capacity to carry anywhere near as much as a car, and (b) surely there should be some reward for using sustainable transport.",Pro-Climate
bafyreibi63nbzoqm6grpbbavat25ptmzotyxpbzx53g5xjlhximm3yeequ,"Any Trump EPA Attempt to Stop Regulating Climate Pollution Won’t Stand up to the Facts. 
The science on climate change is so indisputably well-established, that it’s hard to see how any court would uphold a challenge to it.
www.commondreams.org/opinion/trum...",Pro-Climate
bafyreihzs5s4uoyncdocptyxqby2kdluyo5xkffyd6y3yrjdr6eu5tx7oa,"“You can denounce globalism all you want, but it won’t change the fact that telecommunications, trade, migration and climate change have fused us, and our fates, together.” Great article! www.nytimes.com/2025/04/02/o...",Pro-Climate
bafyreieksbsaxuzbv5l7s2w3xy2mlwmefwgsjoaikcurgisptrck7ti3iy,They are fossil fuel toadies.,Pro-Climate
bafyreibwtdk6smhs5rlufli4qp6sufeqhitkjm56aqd7tcxm2sh2vvt2bi,"""mike, we would never ignore the warning signs that are all around us for something that would imperil our lives and our livelihoods,"" he said in climate change",Pro-Climate
bafyreibw32ozy5fz2h5d3bjpc7bv5iy3qehojf5nccuwyk2utf552mbhdq,"If they can't read, good chance they are scientifically illiterate, too. That would make them susceptible to misinformation and compact theories. Anti vax. Flat earth. Health supplements. Climate change denial.  GOP/MAGA bamboozle. I think you get the idea. 

Advocate for scientific literacy!!!",Pro-Climate
bafyreieblp6u6gzoabmv34htlu3d63ft2vnqdscelqyo27kztn2hqo6ttm,I'm not talking about experts that do good work. Like the scientist who fight for the environment and rightfully educate ppl about climate change. I'm talking about the experts that help prop up corporations and branding.,Pro-Climate
bafyreiexty5gaveh5vvuufl4pklr2s6t2seiwx62ua4ik2lkbraggjddwi,So.....all this Greenland talk is reminding me how the ice shelf/sheets are collapsing there because of climate change and how it's contributing to sea level rise. And that will eventually trigger coastal flooding.,Pro-Climate
bafyreigorovy42weqcx7vby7656s5lepb5pngzdg5eju2gjbs3zx36samu,"The slightest whiff that the 'pro-nuclear' obsession of the Australian National Party (a blatant attempt to derail clean energy in favour of coal power forever) might be reconsidered by the new Liberals leader - and bam, the right-wing Coalition is dead, killed by climate change denial.",Pro-Climate
bafyreicdbxszwkftiiiw6ibnjxbbjimuduzi5sdm6rvo7shi4fyqqc4imm,"His platform mirrors the Canadian Association of Petroleum Producers, which calls for the federal government to abandon all regulation of greenhouse gas emissions.",Pro-Climate
bafyreibokupnap4syghtsr2sjnqlr6xo3kagkvwi3u6f3nbgjccuq3hdqy,"We agree!

It is long past time we had a publicly managed fossil fuel wind-down.

Learn more from fellow Kate Aronoff about how we can make this a reality. ⤵️",Pro-Climate
bafyreihmchtofknnlctobfzmir5rs5lhmep3eccwyisbgvtu6w7vaip3vq,#TakomaPark council: public commenter (former city councilmember Gibson) addresses rent stabilization. Notes a book by a city author on development (and sustainable development in particular).,Pro-Climate
bafyreibaq2vftfoxhdtasdgjytxz4ux4wk5i7stxqm5kwec3yqwvtcbnli,Canada’s New #Greenwashing Law Hasn’t Stopped Politicians’ #CCS Claims #BillC59 #Climate #cdnpoli  www.desmog.com/2024/08/26/c...,Pro-Climate
bafyreihkd6pvtf42ln67la6b5loazaze6l7rptrxxl4yhbbdxqjao35hqq,Colorado Will Require Oil and Gas Companies to Increase Water Recycling for Fracking - Inside Climate News insideclimatenews.org/news/1303202...,Pro-Climate
bafyreidal7nkon4unj2grfw25kypbccdxym3v653half2y2hgw2ppyyzku,"We protested in Manchester today, against Trump and against the British far right that will feel emboldened. Get organised to fight fascism and racism, Climate denial, to defend trans rights and women's rights and to fight for jobs and better pay.",Pro-Climate
bafyreick4dmmzw3eaxydhpmgnlxbsjy3upi7d2zedcxt75ducsmm5uolgq,There have been several tedious trolls popping up recently - several blocks in the last few days of accounts claiming fossil fuels are not the cause of climate change 😬,Pro-Climate
bafyreib7dhplusz3sgm734obbljmp2xx7sa3xrlvi6hqk6g77eukz2g4tq,Yet another dangerous aspect of life in The Petrocene (@johnvaillant.bsky.social's excellent term) aka Petropyrocene (my term combining John's term and @sjpyne.bsky.social's Pyrocene). Not just climate change from our fossil fuel use but also how many everyday items are made of petroleum products.,Pro-Climate
bafyreiabmpcr3uuz4pa7mqb6vjpzdyom4dzzx6yefrznavtoxhvfruqasm,"✨🤲 That's important. Because we need real change. I understand you're scared. It makes sense. 

We are so many who are also looking for the solution, so that living on this planet will be a good and fair and sustainable thing.

You have billions of others who just like you care about this fight.",Pro-Climate
bafyreicgqcdun6lcjx74eywx276et7bavnswtfjjseera4cklq5rvzakca,"If the national energy market is retargetted at Nuclear, turning off a few solar panels is the least of the causes for a death spiral.",Pro-Climate
bafyreian5zkhy77agtpyd5srwidjtx2atuf3epheju26z2jsk67u2vvxny,EPA Greenhouse-Gas Reversal Is Lee Zeldin’s $87 Trillion Mistake - Bloomberg www.bloomberg.com/opinion/arti...,Pro-Climate
bafyreign5tkthkxtiygcjuolu4x43p5tteiq4atqj3pmcmae57a7icunpa,"I believe that the economics of clean versus dirty energy will for the most part ""win"" out even while Republicans are in power in D.C. since money trumps politics for most investors except the most ideological or idealistic in terms of early adopters of cleantech.",Pro-Climate
