segment,cluster_id,merged_id,cluster_claim
Neutral,Neutral_14,0,Corporate polluters disproportionately harm public health and should be held accountable to prevent avoidable suffering.
Neutral,Neutral_19,1,Sustainable aviation fuel is the most viable solution for decarbonizing the aviation industry.
Neutral,Neutral_37,2,Toyota’s marketing of its electrified vehicles misrepresents their environmental and financial benefits.
Neutral,Neutral_4,3,Current policies and political inaction are failing to adequately protect public lands from exploitation and privatization.
Neutral,Neutral_5,4,"Electing candidates with a proven commitment to Vermont families will advance a quality, affordable, and sustainable child care system."
Neutral,Neutral_51,5,Human activities are driving the rapid extinction of endangered wildlife species.
Neutral,Neutral_55,6,Modern work and household demands are unsustainable without significant reductions in labor expectations.
